Title,Ticker,Date,NumberOfTickerMentions,Vader Neg,Vader Pos,Vader Neut,textblob Negative,textblob Positive,textblob Neut
.,NSE,2022-10-18,80,2,3,2,2,3,2
Indian stock market is facing one L after another ,NSE,2024-11-21,80,6,19,28,11,24,18
Which subscription helped you the most in investing journey?,NSE,2024-11-05,80,5,61,84,14,67,69
DII vs FII,NSE,2024-10-31,80,10,24,36,12,28,30
Why this country people are so selfish  and beggars ?,NSE,2024-08-25,80,23,33,83,34,69,36
What are your most successful stock picks? Share your proudest portfolio positions!,NSE,2024-07-30,80,13,57,86,20,51,85
What is the one stock you're the most confident on to even buy at the high price of today,NSE,2024-06-03,80,16,95,187,19,89,190
Today’s Headlines,NSE,2024-04-18,80,0,4,6,0,5,5
F&O - a black hole,NSE,2024-02-01,81,22,38,78,30,59,49
"23, messed up and I’m miserable!!",NSE,2023-12-07,81,6,22,36,16,30,18
Laal hai ,NSE,2023-10-26,81,1,1,4,1,1,4
Ye week pakka profitable hoga,NSE,2023-07-31,81,0,2,10,0,2,10
stock market,NSE,2023-06-23,81,3,5,7,4,3,8
March is going good. Thanks to Options Trading.,NSE,2022-03-25,81,8,28,21,7,24,26
Loude lag geye ajj sabke,NSE,2022-02-14,81,4,7,7,3,2,13
Head and shoulders in nifty,NSE,2024-10-22,81,6,23,38,7,19,41
What is the smartest way to buy GOLD?,NSE,2024-10-06,81,11,33,59,13,42,48
SEBI finally doing some good work with the new FnO rules,NSE,2024-10-02,81,21,37,79,32,79,26
Tools for investment Research,NSE,2024-09-18,81,0,7,6,2,8,3
How Can I Earn 5k Monthly from a ₹3 Lakh Investment in the Stock Market?,NSE,2024-07-08,81,16,82,111,16,101,92
Will Kamath brothers agree to sell Zerodha if Jio Fin offers something that they cant refuse?,NSE,2024-04-19,81,15,35,49,19,46,34
Instiutional Investors bought $700 Million worth shares of Bharthi Airtel,NSE,2024-03-09,81,3,10,23,3,9,24
Share market trolling me fr 😭😭😭,NSE,2024-02-26,81,11,30,52,11,31,51
What are some of the stocks that you’ve bought and now you know they’re never going to reach their original bought price? (Atleast in your lifetime),NSE,2024-01-26,81,29,58,172,38,40,181
Adani Group Borrowings,NSE,2023-01-27,81,3,9,18,5,7,18
Do you know that only 2 out of 6 sharks who are founders of their own businesses in Shark Tank India are profitable. What do you think? Do tell us in the comments!,NSE,2023-01-20,81,8,9,17,4,13,17
What do you think will happen to Zomato now?,NSE,2022-08-22,81,14,14,44,19,21,32
Traders today,NSE,2022-01-28,81,3,1,8,2,2,8
Welcome to market…,NSE,2021-11-15,81,0,3,6,0,3,6
Sell shovels during a Gold rush. Pudumjee Paper - From a Swiggy vs Zomato post.,NSE,2024-12-02,81,3,15,15,6,15,12
Why people invest in MF instead ETF,NSE,2024-11-17,82,8,18,42,9,27,32
Lost almost 30lakhs in fno tu,NSE,2024-11-11,83,33,36,78,30,57,60
Don't panic sell Mazdock!,NSE,2024-08-20,83,7,33,29,14,34,21
I have finally given up today !,NSE,2024-08-07,83,15,29,82,25,65,36
Be a crorepati by the age of 40-45,NSE,2024-07-02,83,18,59,69,24,65,57
Longe term investors today,NSE,2024-05-09,83,9,16,64,14,24,51
"As a trader who has got their ass kicked, what would you do differently if you had to do it all over again?",NSE,2024-01-12,83,9,26,33,13,37,18
All night all day,NSE,2023-12-02,83,0,0,7,0,1,6
I am 23 and recently got a job,NSE,2023-09-24,83,8,54,55,13,58,46
Can you relate?,NSE,2023-03-30,83,0,1,3,0,1,3
my biggest one day loss,NSE,2022-12-23,83,11,18,31,8,19,33
Wise words #StockMarket,NSE,2022-09-14,83,0,3,6,1,4,4
"Somebody knew about ADANI on 19th Itself,,,,,,,,,,,,,,,,3000 PE 10 lakh OI was REDUCED ...............BLUE CELL,,,,,,,,,,,,,,,,,,,,,,highest in this series ",NSE,2024-11-21,84,9,10,23,7,17,18
Sold Too Soon? Seeking Advice on Overcoming Stock Market Regret,NSE,2024-07-21,84,9,15,23,10,20,17
Exit poll fraud,NSE,2024-06-04,84,10,21,37,17,29,22
Today’s Headlines,NSE,2024-04-12,84,0,6,2,0,7,1
One stock you still regret selling! ,NSE,2024-03-02,84,38,64,158,45,48,167
Experts ne toh value trap bola tha😯,NSE,2023-09-18,84,1,2,7,1,2,7
Thoughts?,NSE,2023-08-13,84,7,21,46,12,28,34
Koi nazar nahi lagayega ,NSE,2024-12-05,84,15,21,88,12,9,103
