Title,Ticker,Date,NumberOfTickerMentions,Vader Neg,Vader Pos,Vader Neut,textblob Negative,textblob Positive,textblob Neut
What is meaning of Dalal???,NSE,2023-09-07,45,6,9,76,1,5,85
"1L Milestone, still long way to go.",NSE,2023-08-01,45,7,71,73,12,68,71
For those who YOLO in stock market,NSE,2023-05-10,45,1,5,6,1,5,6
All I need is my laptop and the Internet.,NSE,2022-05-03,45,1,4,6,1,5,5
What's the one stock you're holding onto for the long term and why ?,NSE,2024-07-31,45,20,129,235,40,157,187
MRF just announced 3rs dividend.,NSE,2023-11-03,46,2,26,30,8,14,36
Mudiji hai to mumkin hai 🤗,NSE,2023-12-04,46,9,6,40,8,15,32
"Just wanted to share, first time hitting 1L mark.",NSE,2023-09-11,46,3,57,39,11,48,40
US celebrating raising its debt ceiling.,NSE,2023-06-03,46,2,4,8,4,5,5
Today market taught everyone a lesson   ,NSE,2024-06-04,46,15,28,58,19,47,35
Gautam Adani bought land at the rate of ₹ 1/sqft.,NSE,2024-07-05,46,9,14,32,5,22,28
Done. Lost 2L in one month.,NSE,2023-09-29,47,43,69,143,52,132,71
This guy thinks losing 110k in a single day is a big lesson and it's a fees that market takes from you to teach you,NSE,2023-09-04,47,14,20,40,13,36,25
"Who ever you are, I pray for your mental health 🙏🙏🙏",NSE,2022-03-21,47,4,15,28,6,12,29
Would 3cr be enough for you now to quit your job and to invest and live through your passive income? ,NSE,2024-07-20,47,30,73,115,22,113,83
IPO ka chakkar Babu bhaiyya...,NSE,2023-12-18,47,19,26,79,18,31,75
Gold imports,NSE,2023-10-08,47,3,8,15,2,13,11
"Markets down due to Nirmala Sitaraman new F&O policies, and capital taxes! The day she announced, from next week/day the markets started tanking. Why is no one talking about this, including media ",NSE,2024-11-07,47,17,21,44,23,31,28
Hack for saving Income Tax for salaried folks,NSE,2024-07-28,47,20,40,60,28,58,34
Sabka saath Sabka Vikas🤭,NSE,2024-06-04,47,4,20,30,7,23,24
Let that sink in...,NSE,2022-11-12,47,4,4,13,5,4,12
"GIFT CITY is a smack in the face for the Indian taxpayer and Retail investors. With a 10 year tax break and exemptions from STT, CTT, and stamp duty, No Minimum Alternate Tax (MAT) & Sovereign Wealth Funds enjoy a 4-year tax exemption on interest, profit, and dividends, extended by a year recently..",NSE,2024-05-23,47,20,29,44,24,46,23
Where should I invest?,NSE,2023-10-04,47,30,67,357,27,67,360
I lost,NSE,2024-06-10,47,25,32,63,26,43,51
Lost over 60% in crypto what should i do with the remaining,NSE,2023-10-19,47,45,42,144,30,60,141
Advise to all those who are losing money in trading.,NSE,2023-09-21,47,9,19,20,4,23,21
DONT WORRY GUYS THIS IS NOTHING BIG GOING ON ITS CHINA ,NSE,2024-10-07,47,24,36,83,31,43,69
Ola Electric has all the right ingredients…,NSE,2024-08-19,47,22,22,36,21,30,29
What will be the condition of the stock market today?,NSE,2023-11-22,47,0,13,12,2,15,8
"The government is dis honorable - It will have no guilt in defaulting on payments  - take out your pf, ppf, nps, fd and buy s&p500 pure index funds ",NSE,2024-12-03,47,15,34,59,23,54,31
"OLA Electric IPO is Finally coming, But there's a MAJOR catch.",NSE,2024-07-25,47,17,23,33,14,37,22
Getting a hint today,NSE,2023-10-20,47,3,6,13,4,7,11
"Pls stay away from all these scammers who have been exposed, it would be awesome if mods pin a message with names of these guys so NEW retailers can stay away from them as they don't know the whole story",NSE,2023-09-16,47,19,33,69,17,47,57
Big Billion Wale kidhar hain?? ,NSE,2024-10-22,47,15,33,78,19,43,64
"Ola IPO allotted. Sad day for me, who else got?",NSE,2024-08-08,47,38,64,132,54,80,100
Zomato Investors today,NSE,2022-08-02,47,8,8,22,8,15,15
Ola Electric was always a scam. Change my mind.,NSE,2024-10-08,47,17,22,56,17,41,37
US bullies India and other country currency by dictating rates. The latest news about the BRICS payment app to be adopted by 159 countries didn't sit well with Uncle Sam.,NSE,2024-08-22,47,15,12,33,10,32,18
"Got one , 🤞 for tata tech and gandhar",NSE,2023-11-25,47,29,81,147,32,79,146
No such options for Men,NSE,2022-12-15,47,5,13,14,1,15,16
Relatable...,NSE,2021-05-20,47,1,0,3,0,0,4
Inspiring Journey 😶,NSE,2023-11-02,47,1,2,6,1,6,2
Hyundai IPO Discussion,NSE,2024-10-08,47,15,27,55,24,27,46
Will it cross 1 CR this week ? ,NSE,2024-10-13,47,6,11,40,11,20,26
All of us want to be rich,NSE,2023-09-30,47,14,24,71,28,55,26
Bro took Diversification seriously,NSE,2023-06-23,47,2,8,12,3,9,10
We might see a gap-down opening on Monday!,NSE,2024-11-16,47,4,14,30,14,22,12
5.5 lakh loss in fno,NSE,2024-10-16,48,17,30,69,24,52,40
"For the first time, I have seen that a budget has been made to save the government and not for the welfare of the nation.",NSE,2024-07-23,48,5,15,39,11,19,29
Physical shares of Satyam,NSE,2023-09-29,48,5,19,18,3,14,25
Don't buy the dip ,NSE,2024-11-04,48,22,52,89,29,52,82
Each and every time!,NSE,2023-04-01,48,1,3,7,3,2,6
Today :(,NSE,2021-11-22,48,3,6,11,6,5,9
"Hinderburg exposed Adani,Sebi and kotak",NSE,2024-07-02,48,5,8,24,9,15,13
Please tell me what to do ?,NSE,2024-03-13,48,30,53,136,41,116,62
Finally!!!,NSE,2021-11-08,48,2,1,6,0,3,6
Hyundai IPO: The other side,NSE,2024-10-16,49,5,20,25,12,27,11
Brought the dip! Did you?,NSE,2024-10-03,49,12,36,102,19,49,82
Stock Market and the Indian Lower Middle Class,NSE,2024-08-23,50,14,18,36,11,24,33
Do you guys ever regret not buying enough?,NSE,2023-10-04,50,21,43,58,22,39,61
Trading vs Investing - my 10 years journey so far with markets,NSE,2023-10-03,50,5,26,31,9,36,17
"My biggest win ever, sadly invested only a small amount",NSE,2023-07-23,50,2,22,27,5,24,22
what are you buying in this dip ??,NSE,2022-05-06,50,1,14,35,4,18,28
Losses!!!!!,NSE,2023-04-08,50,0,4,9,1,6,6
FINANCE CRINGE FEST 2023...these guys are performing..whom should i invite more,NSE,2023-03-11,50,23,37,93,25,54,74
Fcuk you money,NSE,2023-09-07,50,2,3,5,2,5,3
BUY!!!!,NSE,2023-05-24,50,1,3,10,1,3,10
Final Update: Crazy YOLO idea of putting my vacation money in one stock (Success Story),NSE,2024-10-03,50,0,11,16,6,10,11
Finally closed my F&o segment in Zerodha ,NSE,2024-03-27,50,18,43,106,27,88,52
FII Sold 70000Cr in October but I don't think there is any reason to worry.,NSE,2024-10-17,52,17,32,44,18,41,34
Adani stock right now,NSE,2023-04-03,52,0,1,4,0,4,1
stinks!!!,NSE,2022-10-09,52,2,7,9,1,8,9
Was going through Parag Parikh Flexi Cap fund latest portfolio and found this,NSE,2024-11-09,52,11,23,41,17,30,28
Everywhere I go I see her face,NSE,2023-04-23,52,0,3,14,0,3,14
NOC,NSE,2023-02-05,52,17,29,62,16,26,66
for real 🤌,NSE,2023-10-11,52,0,6,19,0,7,18
Wait what?,NSE,2023-03-23,52,8,6,35,9,9,31
Former RBI governor on Bitcoin,NSE,2022-12-15,52,14,4,35,15,9,29
Think about it!,NSE,2022-09-18,52,2,12,12,4,11,11
U.S. NATIONAL DEBT HITS $35 TRILLION ,NSE,2024-07-29,52,30,26,46,21,43,38
Who are sliding in this down slide 😁,NSE,2023-11-10,52,13,18,69,18,27,55
Got dividend even after selling stock?,NSE,2023-09-18,52,2,10,24,3,8,25
Getting too much profit,NSE,2023-09-07,52,5,25,40,5,21,44
✅,NSE,2022-11-19,52,1,6,9,1,5,10
Monthly Analysis of PPFAS ,NSE,2024-10-19,52,0,16,17,5,15,13
Everyone in India want crash 😂,NSE,2024-08-01,52,16,16,46,13,29,36
Nvidia recently gained 15%. What is shocking that 15% gain is approx same as total Market Capital of Reliance.,NSE,2024-02-24,52,13,24,38,12,35,28
"Refex Industries: ""A Company Profiting from Coal Dust""",NSE,2024-09-04,52,2,36,34,6,42,24
He will be missed.,NSE,2023-11-29,52,5,3,8,1,3,12
retail traders,NSE,2023-08-26,52,3,6,18,1,7,19
Global Markets are all surging with the Trump Win. Trump is here and the world will be better for it.,NSE,2024-11-06,52,33,44,109,36,101,49
adani left his company and started full time reddit,NSE,2023-02-23,52,1,2,8,0,6,5
Buy the dip ..,NSE,2022-10-11,52,3,14,31,4,22,22
My portfolio has recovered. is yours ? ,NSE,2024-12-02,52,9,35,62,17,28,61
Started Swing Trading 6 months back,NSE,2023-11-14,52,3,28,54,12,32,41
"Delta Corp got served 11,000 crore GST notice. Market cap of the company is only 4,700 crore 😂",NSE,2023-09-22,52,21,29,55,16,31,58
Can I become a finfluncer now ?,NSE,2023-09-08,52,8,35,82,7,29,89
Most misleading video of Akshat I have seen till data,NSE,2024-12-04,53,13,28,42,18,43,22
Monthly SIPs are at 25000 crores now - this is despite the stock slide,NSE,2024-11-12,53,7,22,54,11,35,37
Hyundai IPO might get cancelled ,NSE,2024-10-16,53,6,22,58,8,28,50
Maharashtra way ahead.,NSE,2022-12-14,53,6,22,27,6,26,23
Stock market maymay,NSE,2022-05-18,53,3,4,11,2,8,8
For those celebrating Trump’s victory: FIIs remain net sellers today with 4500 Cr in selling.,NSE,2024-11-06,53,10,16,30,6,25,25
What if tomorrow…..,NSE,2024-07-22,53,10,25,67,9,20,73
Started F&O trading 10 days ago with rs 9.5k. 25k profit,NSE,2023-11-15,53,7,27,50,7,19,58
Lost 40 lakhs in 2 years now don't know how to manage it.,NSE,2023-09-23,53,25,68,119,22,90,100
"Macro predictions for the first quarter of 2024, let's discuss back on 31st March, 2024 ( No specific stocks )",NSE,2024-01-07,53,21,28,42,8,43,40
New Day New Reason..😂 this is never-ending,NSE,2022-01-16,53,12,8,19,5,12,22
Mujhe tho profit se matlab hai,NSE,2021-05-09,53,3,12,9,2,13,9
Mutual funds with value & retirement themes in vesting in this trash IPO.,NSE,2023-11-01,53,11,12,16,14,11,14
Where are you bloodbath guys ?,NSE,2024-10-08,54,22,43,65,29,49,52
Sister sending me 25Lacs to invest!!,NSE,2024-10-03,54,23,37,69,17,59,53
UPI>Cards,NSE,2022-04-18,54,7,9,9,3,14,8
"Stop with the bullsh*t fii's are trying to create panich, they be jealous ffs",NSE,2024-11-01,54,8,12,21,7,20,14
Putting 5lacs in 1 stock when my whole portfolio is 10lacs only. ,NSE,2024-07-17,55,51,117,190,46,136,176
Mama Earth Listing 😲,NSE,2023-11-07,55,15,14,90,11,26,82
That always happens to me,NSE,2021-07-14,55,0,2,7,1,1,7
"Can people stop investing for 2 months atleast,so that they understand the pain of increasing the ltcg and stcg tax?",NSE,2024-07-24,55,24,33,38,11,46,38
Innflaationnn,NSE,2023-03-03,55,0,1,3,0,1,3
The Big Billion Days Sale is here!,NSE,2024-10-03,55,4,5,21,4,9,17
So interest in savings accounts gets taxed at 30% but STGC is 15%. Why should I keep any large amount in savings bank?,NSE,2024-07-29,55,27,36,72,27,53,55
Us 🤣,NSE,2023-10-26,55,2,1,10,3,5,5
Gautam Adani becomes the 2nd richest person in the world. Meanwhile Others:,NSE,2022-09-17,55,8,9,18,3,11,21
Name one stock that made you a lot of money and one stock that took away a lot of money,NSE,2023-09-05,56,27,34,131,26,50,116
"I'm a former consultant at Goldman but after I discovered my snake oil selling skills to novices, I'm rich (look at my smile). You want some snake oil?",NSE,2022-10-10,56,13,40,69,22,58,42
When this bull run is going to end?,NSE,2024-06-13,56,21,36,131,28,47,113
Markets is only for ULTRA RICH,NSE,2024-03-04,56,9,32,52,16,53,24
This regret,NSE,2024-02-19,56,12,42,57,13,65,33
Portfolio review: suggest buy/sell/hold,NSE,2023-11-05,56,6,42,49,19,47,31
Sed Life!,NSE,2022-10-31,56,0,6,5,0,7,4
What do we think about the Tata Tech ipo?,NSE,2023-11-09,56,8,22,31,10,23,28
Best way to explain Stock Market to Newbies !!!,NSE,2023-05-12,56,0,3,2,0,3,2
Hehe,NSE,2023-05-04,56,1,2,4,1,1,5
"Please stop with the ""what should I do with Tata motors"" or ""Should I sell everything"" or ""Should I stop my SIP"" ",NSE,2024-11-14,56,13,12,26,8,24,19
"Would You Want to See Nifty Drop Below 23,000? Why or Why Not?",NSE,2024-11-04,58,11,39,58,17,48,43
TO ALL YOUNG TRADERS!! AN ADVICE NO ONE WILL GIVE,NSE,2024-10-12,58,4,12,15,3,22,6
"1 crores Adani shares traded today, on Friday the volume was 8 lacs. I am sure hardy retail investors were involved in this massive selling and buying. And still sensex and nifty end in red zone today.
",NSE,2024-08-12,58,2,5,25,10,9,13
.,NSE,2023-02-18,58,0,1,3,0,1,3
People with Adani stocks. What's the plan now?,NSE,2024-11-21,58,35,49,94,36,72,70
Left job and took 1 crore loan for full time trading ,NSE,2024-06-23,58,41,85,154,49,90,141
Sed Life,NSE,2022-12-05,58,1,6,12,2,4,13
Applied for waaree IPO and Got this message from bank today morning.... What does this mean?,NSE,2024-10-25,58,3,11,17,6,7,18
Why is Zerodha become so unreliable?,NSE,2023-12-04,58,20,39,73,24,44,64
So what did you buy for your investment portfolio on Diwali muhurat day ?,NSE,2023-11-12,58,13,104,184,29,73,199
To Brighten Up Your Day!,NSE,2023-03-13,58,1,3,2,0,3,3
Happy diwali,NSE,2021-11-05,58,1,4,3,1,5,2
THIS IS THE BEST TIME TO BUY !,NSE,2024-06-07,58,8,19,45,5,28,39
Rant: I find most people in this community dumb,NSE,2024-03-10,58,6,22,37,10,24,31
Loss 67k in option trading..Totally depressed,NSE,2023-10-10,58,35,70,112,23,102,92
Bull spotted chilling outside Stock Exchange chilling with Investor,NSE,2022-05-26,58,1,2,2,1,2,2
Is This Bull Run for Real or Just a Trap? ,NSE,2024-11-25,58,33,47,78,29,79,50
The most valuable lesson in investing is in living a modest life beneath your means,NSE,2024-11-09,58,1,11,7,2,13,4
Nifty50 has fallen 1%. Should I sell my corpus of 500 rupees,NSE,2024-02-14,58,10,19,34,11,12,40
"IREDA, RVNL, IRFC are all in a bubble",NSE,2024-01-30,58,14,54,77,18,54,73
Take loan @12% and Invest same in Mutual Fund?,NSE,2023-09-10,59,36,84,160,44,115,121
ONE stock you’re bullish for with reason,NSE,2024-08-28,59,28,83,193,28,112,164
LIC Investment in different companies,NSE,2023-01-29,59,4,6,13,2,8,13
Stonks!,NSE,2021-04-09,59,0,0,5,0,0,5
Indian stock markets manipulated or actually strong?,NSE,2024-07-25,59,17,29,42,16,38,34
Suzlon is a f**king trap!,NSE,2023-12-23,59,13,39,63,11,51,53
Who do you this this would be this time? Any guesses,NSE,2023-08-25,59,12,30,74,19,30,67
I am 16 and started investing recently,NSE,2023-08-21,59,16,63,100,13,75,91
India Q2 GDP: GDP Growth Hits 8-Quarter Low at 5.4%: What's Slowing Down the Economy?,NSE,2024-11-29,59,14,38,75,32,45,50
What the hell is wrong with indian market?,NSE,2024-06-27,59,30,51,101,46,83,53
Has anyone made big money from Stock Market?,NSE,2024-06-13,59,24,107,166,40,144,113
Ji ha dosto wo bhi sone ka hai,NSE,2023-07-18,59,1,4,10,2,5,8
What is happening in the uranium sector? + Break out of uranium price starting now (2 triggers) + uranium spot and LT price just started to increase,NSE,2024-10-11,59,0,20,13,2,20,11
Very Sad News !! RIP Rahul,NSE,2022-03-28,59,16,12,39,8,21,38
"31yo quit day trading after 7 years, Help me!",NSE,2024-11-23,59,14,68,53,19,85,31
1 cr in Hand. Please Explain Best Way to Invest all possible ways.,NSE,2024-09-22,59,15,69,99,23,99,61
Old Days of Indian Stock Market ,NSE,2023-09-06,59,1,2,8,1,3,7
:(,NSE,2022-12-19,59,4,2,9,4,4,7
LIC stock after IPO:,NSE,2022-10-21,59,3,3,13,0,3,16
Aur bhaiyo kesa chal rha he? Aa gaya swaad?,NSE,2022-07-26,59,9,18,34,13,16,32
"Following the same analogy, it is the trainers who make the actual profit. Now it all makes sense.",NSE,2023-06-04,59,2,9,8,3,9,7
Ye time bhi beet jayega!,NSE,2023-03-02,59,4,6,13,6,8,9
NIFTY goes brrr..!,NSE,2022-11-03,59,3,6,21,1,7,22
Imagine when Modi & Shah enters Shark tank India to sell LIC,NSE,2022-02-16,59,0,1,3,0,2,2
"Instead of worrying whether Swiggy or Zomata or other quick commerce companies will perform, I just sit back and invest in companies that provide packaging papers to these companies(Proxy Companies)",NSE,2024-10-31,59,5,22,40,9,23,35
Everyone's is against the short seller - Hindenburg - Buch - Adani Saga continues,NSE,2024-08-11,59,16,33,54,22,50,31
Nifty in party mood!! Show me your today's profit porn,NSE,2024-07-26,59,17,39,103,15,42,102
"Very good quote I read in a book recently by Peter Lynch ""If everyone knew that stock market was going to crash next year, it would crash today and not next year""",NSE,2024-06-19,59,7,6,18,5,16,10
Time for pushups,NSE,2023-02-04,59,0,4,1,0,2,3
:),NSE,2022-11-02,59,1,7,7,1,10,4
I have 69 @213 ...only for memes,NSE,2022-01-06,59,0,7,10,2,6,9
Don't sell your Midcap and Smallcaps,NSE,2024-10-07,59,10,33,42,10,47,28
India Daybook – Stocks in News,NSE,2024-02-19,59,3,16,11,3,17,10
Now it's confirmed that stocks move when I sell them. 😆,NSE,2024-02-01,59,9,22,53,12,26,46
15% tax on capital gain,NSE,2024-06-25,59,20,44,60,16,58,50
"100% Value Investing. Don't follow tips. Only keep an eye on corp gov issues. Stocks selected based on my own method. Once I am invested, I buy in dips & hold forever.",NSE,2022-12-11,59,4,49,37,15,43,32
bear consider it what going on,NSE,2021-08-18,59,0,5,4,2,1,6
"Ex-swiggy employee, should I sell my shares on IPO?",NSE,2024-11-07,59,7,46,51,16,51,37
Dipped stocks which are worth investing currently ? ,NSE,2024-10-30,59,18,66,145,25,70,134
Guess how much profit Hindenburg made now?,NSE,2024-10-27,59,5,14,25,13,20,11
Before tomorrows bloodbath let's have some laugh..,NSE,2023-01-29,59,2,9,8,0,11,8
1 Lakh for 1 month,NSE,2024-08-02,59,24,79,136,22,86,131
All of us are investing in stocks when the real money is somewhere else,NSE,2023-09-09,59,2,14,17,3,19,11
"Well, Read the comments once.",NSE,2023-01-31,59,12,15,40,16,26,25
Indeed....,NSE,2022-01-02,59,2,7,16,4,10,11
FII Exodus from India making global news,NSE,2024-11-05,59,11,23,43,14,36,27
Will you quit if markets crashes to 30%?,NSE,2024-07-14,59,35,33,93,33,75,53
Found this on r/investing about technical analysis,NSE,2023-10-08,59,5,5,7,5,8,4
JUST INCASE PPL WHO ARE NEW AND DO NOT WANT TO READ NEWS,NSE,2024-11-04,59,3,10,9,3,14,5
"My Investing Journey with One Particular Stock (₹23L Realized, ₹7.5L Unrealized Profit)",NSE,2024-09-02,59,1,8,26,2,22,11
Maximize your investment amount rather than maximizing your return,NSE,2024-08-03,59,3,12,20,3,19,13
Stopped Fno,NSE,2024-05-28,59,13,30,44,17,52,18
"Don't Panic, it's just a correction",NSE,2023-12-20,59,12,39,52,18,38,47
Charlie Mungers opinion on people try to sell you courses & books on Trading,NSE,2023-09-02,59,4,9,12,4,9,12
Personal Finance Rules.,NSE,2021-06-09,59,1,4,4,1,6,2
My small contribution to ITC,NSE,2021-05-27,59,3,11,5,4,8,7
What you think about this?,NSE,2022-11-04,59,15,22,33,9,26,35
Exactly,NSE,2021-11-10,59,3,6,17,3,9,14
What’s one stock you think is undervalued right now and why?,NSE,2024-10-20,59,18,64,160,28,80,134
Guys chill tf down ,NSE,2024-10-07,59,10,15,26,8,22,21
What's your today total portfolio loss?,NSE,2024-08-05,59,52,62,234,49,76,223
Ladies and GentleMen,NSE,2023-11-24,59,1,5,5,0,6,5
Adani Total Gas hit lower circuit every day since Hindenburg - 18 sessions,NSE,2023-02-22,59,19,18,46,17,32,34
Thoughts...?,NSE,2023-02-14,59,3,10,17,5,15,10
LIC,NSE,2022-10-08,59,2,5,17,2,7,15
Admit it! ITC has a fanbase,NSE,2021-06-04,59,1,4,4,2,4,3
"BJP retained Defence, Finance, Railways. Apologies but can't believe",NSE,2024-06-10,59,0,1,0,0,0,1
Market these days,NSE,2023-06-26,59,2,2,8,1,1,10
It's a never ending story,NSE,2021-06-22,59,0,0,7,1,1,5
Shit!!!!,NSE,2021-05-19,59,1,0,5,2,1,3
"If Everyone in India Starts Investing Smartly, Won't Everyone Become Rich?",NSE,2024-06-19,59,20,59,97,25,104,47
Context please,NSE,2023-01-06,59,7,11,13,6,11,14
How much are you down today?,NSE,2024-11-04,59,28,48,277,68,61,224
I have 3 lakh rupees to invest on Monday. Please recommend fundamentally strong stocks to buy and forget for 2 years,NSE,2024-10-26,59,20,79,132,22,107,102
"Nestle may get into difficulty since a report suggests that it adds sugar to infant milk products supplied in India, other Asian, and African nations.",NSE,2024-04-17,59,9,9,28,13,15,18
Anyone else is also fearing that bloodbath is just round the corner??,NSE,2023-12-15,59,12,38,61,23,46,42
"Market did not even fall 10%, People already started comparing 1929, 2000 Crash. What is causing this panic ?",NSE,2024-10-24,59,22,26,68,15,60,41
Hold or sell?,NSE,2024-09-22,59,2,20,36,4,17,37
THINGS TO KNOW TODAY 15-3-2024,NSE,2024-03-15,59,2,28,13,5,18,20
Help! I made a huge mistake,NSE,2023-12-01,59,20,45,80,26,67,52
What is happening with Godrej Industries!?,NSE,2023-10-08,59,4,7,34,3,6,36
Itna bhi saach nahi na bolna tha XD,NSE,2023-02-03,59,1,2,2,1,1,3
To Brighten Up Your Day!,NSE,2022-12-10,59,2,4,1,1,3,3
Repo Rate,NSE,2022-09-30,59,4,8,20,0,10,22
"
Akshat Shrivastava has a lot of power to manipulate stocks ",NSE,2024-07-15,59,17,23,39,19,28,32
Sach mein stonks hogaya yeh tho!,NSE,2021-06-21,59,3,1,7,3,3,5
"ONE Stock You're bullish on, with reason",NSE,2024-01-21,60,14,100,125,29,95,115
3 year returns for comparison. How has your portfolio fared ?,NSE,2023-11-11,60,2,9,23,5,12,17
why nobody talks about Bajaj and Aditya Birla group??,NSE,2023-03-01,60,2,9,11,6,10,6
quotes to be noted,NSE,2023-02-11,60,1,6,3,2,4,4
Bitcoiners to Elon,NSE,2021-05-17,60,1,3,8,3,5,4
market news,NSE,2024-08-07,60,0,0,10,1,3,6
Why India can never grow like China,NSE,2024-07-27,60,23,54,83,20,85,55
Even Warren Buffett lost money from investment in Paytm. Then what are the chances for remaining shareholders?,NSE,2023-11-24,60,8,10,20,4,14,20
Hangseng bulls where are thou ?,NSE,2024-10-08,60,14,36,61,23,37,51
It is funny because it is true.,NSE,2024-08-12,60,4,5,9,4,8,6
"We did the worst youtubers/ finfluencers, now the one's that you like or find bearable.",NSE,2024-07-20,60,11,55,56,12,60,50
How is this stock for investing 4k and forgetting?,NSE,2023-10-01,60,14,37,39,10,33,47
harsh truth 🤣,NSE,2022-09-22,60,4,4,8,4,4,8
WWIII on the way?,NSE,2024-11-19,60,26,13,57,21,38,37
Monthly Analysis of Quant Small Cap Fund ,NSE,2024-09-26,60,5,22,21,13,24,11
Zerodha's new update is really unwanted,NSE,2024-08-27,60,20,30,47,21,38,38
What are you buying in this dip? Here is my list 👇,NSE,2024-07-19,60,22,81,121,35,97,92
Biggest Regret So Far 🥲🥲🥲,NSE,2023-11-09,60,5,13,30,8,12,28
To those who became long term Hyundai investors today ,NSE,2024-10-22,60,14,29,43,17,36,33
Only use Groww if you want to LOSE YOUR MONEY!!! ,NSE,2024-08-16,60,12,32,40,19,38,27
"Why is it that, The Prime minister, Home minister and Finance minister tells everyone to buy before 4 june, and then market crashes, shouldn't sebi take action against them?",NSE,2024-06-04,60,14,12,43,17,21,31
Which one do you recommend?,NSE,2022-12-22,60,7,28,34,12,32,25
Iska maa k FII MARU,NSE,2024-11-28,61,16,28,61,9,31,65
What did I just witness??,NSE,2024-09-05,61,8,12,20,9,13,18
"It’s really hard to buy a stock on its premium price which you have bought really cheap,",NSE,2024-07-11,61,4,18,30,5,27,20
Will the Indian stock market ever crash?,NSE,2023-09-30,62,30,51,82,32,81,50
Why isn’t the Indian government unable to widen the tax net,NSE,2024-07-28,62,15,29,50,23,42,29
"Free stock analysis for all, but here are the rules:",NSE,2024-06-18,62,27,247,436,64,204,442
My Sympathies ❤️,NSE,2023-09-29,62,2,4,17,4,8,11
Predicted this correction a week ago!,NSE,2023-09-12,62,3,20,33,8,23,25
APNA TIME AAGYA,NSE,2022-11-09,62,1,6,16,1,9,13
On point,NSE,2022-02-02,62,0,1,1,0,1,1
BHEL scam,NSE,2024-10-28,62,10,22,34,13,25,28
15+ Years in the Markets: Ask Away,NSE,2024-09-15,62,19,74,78,23,88,60
Rich trader have no time for reddit.?,NSE,2024-03-25,62,7,22,24,6,28,19
Ireda so high it's on drugs,NSE,2023-12-12,62,16,40,108,24,54,86
Nifty 2001-2021: A complete thread on 2 decades,NSE,2021-07-10,62,0,27,22,11,31,7
Euphoria!,NSE,2024-10-03,62,8,12,18,4,20,14
A must read.,NSE,2024-09-11,62,6,6,20,6,19,7
I was trading and this happened,NSE,2023-09-22,62,18,19,54,14,15,62
Coal India - The star of my portfolio,NSE,2022-08-08,62,5,19,19,8,11,24
Regarding Tata motors don't listen to anyone telling cyclic!,NSE,2024-11-05,62,11,26,50,10,30,47
Waiting for some panic posts,NSE,2024-11-04,62,19,30,65,21,31,62
These are Golden Words of Stock Market IMO!!!,NSE,2024-06-21,62,9,15,33,8,24,25
Me trying to convince my friends To invest in suzlon/ do f&o,NSE,2024-01-13,62,1,5,4,1,1,8
How do i sell this shit??,NSE,2023-08-23,62,8,31,62,15,24,62
Hinderberg twitter handle posted something big India. They are shorting some stock.,NSE,2024-08-10,62,6,29,78,17,32,64
Gold prices that no one talking about.,NSE,2024-07-17,62,3,27,31,6,30,25
Been in the Markets for 3+ Years.... This is my Progress so Far.. AMA,NSE,2024-07-14,62,3,41,48,8,50,34
Our markets are a joke .,NSE,2024-04-30,62,26,30,78,24,43,67
We are told to check P/E ratio but how many people know what it means?,NSE,2024-03-25,62,6,15,18,4,13,22
People forget its still large bank ...!,NSE,2024-01-26,62,7,20,38,9,30,26
"Buy what is being bought, sell what is being sold.",NSE,2023-10-10,62,12,28,43,12,42,29
India's Oldest Unicorns are in the market for more than 10 years & still loss-making! What do you think reason behind it? Tell us in the comments!,NSE,2022-11-10,62,9,17,35,11,31,19
This happens when I enter a Trending stock,NSE,2021-06-29,62,2,14,15,3,19,9
"You see a car, i see adani group shares.",NSE,2021-06-14,62,1,9,10,2,6,12
Tata Power for the long term!,NSE,2024-09-29,62,7,14,24,6,26,13
Loss Porn,NSE,2024-07-23,62,29,30,115,19,26,129
Help! Did I get the correct DOMS?,NSE,2023-12-19,62,2,13,17,2,13,17
Thoughts?,NSE,2023-02-23,62,5,8,23,1,11,24
FII sold another 5000 Cr today!! (Continuing the tradition of daily FII selling data update :D),NSE,2024-10-24,62,8,27,39,12,31,31
SIP of 45k per month,NSE,2024-09-24,62,19,36,44,12,39,48
What is that one stock you'll invest 1 lakh in TODAY? ,NSE,2024-09-15,62,19,84,180,25,97,161
How to generate 10-15k regular income from Investment,NSE,2024-08-12,62,7,64,82,14,72,67
Lost money in F&O ,NSE,2024-07-22,62,19,31,82,13,64,55
Now this is interesting! (Probably getting banned now),NSE,2024-02-13,62,10,17,36,11,23,29
1st Jan News Highlights from Stock Market,NSE,2024-01-01,62,1,13,14,1,10,17
STT is a blessing in disguise,NSE,2023-12-08,62,4,9,19,5,11,16
"I did not ask for MTF Pledge, Angel Broking automatically pledged my shares!",NSE,2023-09-22,62,11,13,25,10,18,21
Stock Selection Framework,NSE,2023-08-14,62,0,11,12,0,14,9
Killing The ITC Investors,NSE,2021-06-13,62,2,2,4,2,3,3
Sold Tata Motors Shares to fund my Toyota Car. Hope I wasn't unethical.,NSE,2024-11-11,62,2,17,28,6,30,11
Stop blaming SEBI chairperson,NSE,2024-03-13,62,28,25,64,29,45,43
Please raise the standard of this sub.,NSE,2024-02-13,62,4,10,13,4,15,8
